{
  "bundle_id": "urn:mrr:offline-bundle:01J00000000000000000000095",
  "bundle_nonce": "example-bundle-nonce-0001",
  "sender_node_id": "urn:mrr:node:01J00000000000000000000091",
  "sender_practice_id": "urn:mrr:practice:01J00000000000000000000001",
  "recipient_node_id": "urn:mrr:node:01J00000000000000000000003",
  "created_at": "2026-07-19T12:00:00Z",
  "expires_at": "2026-07-26T12:00:00Z",
  "entries": [
    {
      "message_id": "urn:mrr:node-message-envelope:01J00000000000000000000090",
      "payload_kind": "TaskBundle",
      "envelope_content_hash": "sha256:a27fac6d5d9313501b1132085050509d4b39630a8aa2956917809137afa93500"
    }
  ],
  "envelopes": [
    {
      "message_id": "urn:mrr:node-message-envelope:01J00000000000000000000090",
      "sender_node_id": "urn:mrr:node:01J00000000000000000000091",
      "sender_practice_id": "urn:mrr:practice:01J00000000000000000000001",
      "recipient_node_id": "urn:mrr:node:01J00000000000000000000003",
      "sent_at": "2026-07-19T12:00:00Z",
      "expires_at": "2026-07-19T12:05:00Z",
      "payload_kind": "TaskBundle",
      "payload_content_hash": "sha256:cccccccccccccccccccccccccccccccccccccccccccccccccccccccccccccccc",
      "payload": {
        "id": "urn:mrr:task:01J00000000000000000000006",
        "kind": "TaskBundle",
        "content_hash": "sha256:cccccccccccccccccccccccccccccccccccccccccccccccccccccccccccccccc",
        "purpose": "Recompute the percentage in a benchmark table."
      },
      "signature": {
        "signer_practice_id": "urn:mrr:practice:01J00000000000000000000001",
        "key_id": "key-2026-01",
        "algorithm": "Ed25519",
        "signed_at": "2026-07-19T12:00:00Z",
        "value": "FFFFFFFFFFFFFFFFFFFFFFFFFFFFFFFFFFFFFFFFFFFFFFFFFFFFFFFFFFFFFFFFFFFFFFFFFFFFFFFFFFFFFFFF"
      }
    }
  ],
  "encryption": {
    "scheme": "none"
  },
  "signature": {
    "signer_practice_id": "urn:mrr:practice:01J00000000000000000000001",
    "key_id": "key-2026-01",
    "algorithm": "Ed25519",
    "signed_at": "2026-07-19T12:00:00Z",
    "value": "EEEEEEEEEEEEEEEEEEEEEEEEEEEEEEEEEEEEEEEEEEEEEEEEEEEEEEEEEEEEEEEEEEEEEEEEEEEEEEEEEEEEEEEE"
  }
}
